{
  "backend": {
    "name": "hf_reference",
    "reproducibility_class": "same_process_seeded_reference",
    "version": "5.14.1"
  },
  "cells": [
    {
      "cell_id": "p128-r64-n1-greedy",
      "counts": {
        "generated_tokens": 256,
        "generated_trajectories": 4,
        "logical_prompts": 4,
        "physical_batches": 1,
        "prompt_tokens": 512
      },
      "error": null,
      "memory": {
        "peak_allocated_bytes": 572068864,
        "peak_reserved_bytes": 1109393408,
        "process_rss_bytes": 2620805120,
        "teardown_residual_allocated_bytes": 8520704
      },
      "oom_downshifts": 0,
      "output_token_ids_sha256": "cd9f13d9e943573baeb2d4e1dd04b122c4faceda6069544c4a48df4a673d8643",
      "phases": {
        "actor_update": {
          "note": "rollout-only baseline cell; full-cycle measurement is a separate gate",
          "status": "not_measured"
        },
        "cold_start": {
          "median_seconds": 8.762755541000004,
          "minimum_seconds": 8.762755541000004,
          "note": "shared actor/tokenizer load measurement repeated on each cell",
          "status": "measured"
        },
        "decode": {
          "note": "the pre-v0.11 public backend does not expose a decode boundary",
          "status": "not_measured"
        },
        "full_cycle": {
          "note": "rollout-only baseline cell; no phase is represented as zero",
          "status": "not_measured"
        },
        "policy_sync": {
          "note": "hf_reference uses the actor already loaded in the trainer process",
          "status": "not_applicable"
        },
        "prefill": {
          "note": "the pre-v0.11 public backend does not expose a prefill boundary",
          "status": "not_measured"
        },
        "rollout_total": {
          "median_seconds": 2.682791788000003,
          "minimum_seconds": 2.658286367999999,
          "status": "measured"
        },
        "teacher_scoring": {
          "note": "rollout-only baseline cell; full-cycle measurement is a separate gate",
          "status": "not_measured"
        },
        "teardown": {
          "median_seconds": 0.2742385410001589,
          "minimum_seconds": 0.2742385410001589,
          "note": "shared backend teardown measurement repeated on each cell",
          "status": "measured"
        }
      },
      "prompt_length": 128,
      "rates": {
        "output_tokens_per_second": 95.42298479705937,
        "prompt_tokens_per_second": 190.84596959411874,
        "time_to_first_token_seconds": null
      },
      "response_bound": 64,
      "sampled_logprobs_sha256": "1e08a89c7b3790ce57c3f26d242c0cc91c11df1eeec95b2a2a00ad2afd17d746",
      "samples_per_prompt": 1,
      "sampling": "greedy",
      "status": "completed"
    },
    {
      "cell_id": "p128-r64-n1-seeded_stochastic",
      "counts": {
        "generated_tokens": 256,
        "generated_trajectories": 4,
        "logical_prompts": 4,
        "physical_batches": 1,
        "prompt_tokens": 512
      },
      "error": null,
      "memory": {
        "peak_allocated_bytes": 576205312,
        "peak_reserved_bytes": 1130364928,
        "process_rss_bytes": 2620805120,
        "teardown_residual_allocated_bytes": 8520704
      },
      "oom_downshifts": 0,
      "output_token_ids_sha256": "cd9f13d9e943573baeb2d4e1dd04b122c4faceda6069544c4a48df4a673d8643",
      "phases": {
        "actor_update": {
          "note": "rollout-only baseline cell; full-cycle measurement is a separate gate",
          "status": "not_measured"
        },
        "cold_start": {
          "median_seconds": 8.762755541000004,
          "minimum_seconds": 8.762755541000004,
          "note": "shared actor/tokenizer load measurement repeated on each cell",
          "status": "measured"
        },
        "decode": {
          "note": "the pre-v0.11 public backend does not expose a decode boundary",
          "status": "not_measured"
        },
        "full_cycle": {
          "note": "rollout-only baseline cell; no phase is represented as zero",
          "status": "not_measured"
        },
        "policy_sync": {
          "note": "hf_reference uses the actor already loaded in the trainer process",
          "status": "not_applicable"
        },
        "prefill": {
          "note": "the pre-v0.11 public backend does not expose a prefill boundary",
          "status": "not_measured"
        },
        "rollout_total": {
          "median_seconds": 8.552983923,
          "minimum_seconds": 8.483651064,
          "status": "measured"
        },
        "teacher_scoring": {
          "note": "rollout-only baseline cell; full-cycle measurement is a separate gate",
          "status": "not_measured"
        },
        "teardown": {
          "median_seconds": 0.2742385410001589,
          "minimum_seconds": 0.2742385410001589,
          "note": "shared backend teardown measurement repeated on each cell",
          "status": "measured"
        }
      },
      "prompt_length": 128,
      "rates": {
        "output_tokens_per_second": 29.931074617314,
        "prompt_tokens_per_second": 59.862149234628,
        "time_to_first_token_seconds": null
      },
      "response_bound": 64,
      "sampled_logprobs_sha256": "ba2f11193cd4eecb8e13f902cb1f94be663a23fa8604436173c7e8ac96885339",
      "samples_per_prompt": 1,
      "sampling": "seeded_stochastic",
      "status": "completed"
    },
    {
      "cell_id": "p128-r64-n4-greedy",
      "counts": {
        "generated_tokens": 1024,
        "generated_trajectories": 16,
        "logical_prompts": 4,
        "physical_batches": 4,
        "prompt_tokens": 2048
      },
      "error": null,
      "memory": {
        "peak_allocated_bytes": 572068864,
        "peak_reserved_bytes": 1130364928,
        "process_rss_bytes": 2620805120,
        "teardown_residual_allocated_bytes": 8520704
      },
      "oom_downshifts": 0,
      "output_token_ids_sha256": "3b4b83de35b1d649fe3f49cf2489de7a434a97304abb50ee7ef985da4ea3b328",
      "phases": {
        "actor_update": {
          "note": "rollout-only baseline cell; full-cycle measurement is a separate gate",
          "status": "not_measured"
        },
        "cold_start": {
          "median_seconds": 8.762755541000004,
          "minimum_seconds": 8.762755541000004,
          "note": "shared actor/tokenizer load measurement repeated on each cell",
          "status": "measured"
        },
        "decode": {
          "note": "the pre-v0.11 public backend does not expose a decode boundary",
          "status": "not_measured"
        },
        "full_cycle": {
          "note": "rollout-only baseline cell; no phase is represented as zero",
          "status": "not_measured"
        },
        "policy_sync": {
          "note": "hf_reference uses the actor already loaded in the trainer process",
          "status": "not_applicable"
        },
        "prefill": {
          "note": "the pre-v0.11 public backend does not expose a prefill boundary",
          "status": "not_measured"
        },
        "rollout_total": {
          "median_seconds": 10.549273207999988,
          "minimum_seconds": 10.186481839999999,
          "status": "measured"
        },
        "teacher_scoring": {
          "note": "rollout-only baseline cell; full-cycle measurement is a separate gate",
          "status": "not_measured"
        },
        "teardown": {
          "median_seconds": 0.2742385410001589,
          "minimum_seconds": 0.2742385410001589,
          "note": "shared backend teardown measurement repeated on each cell",
          "status": "measured"
        }
      },
      "prompt_length": 128,
      "rates": {
        "output_tokens_per_second": 97.06829843248867,
        "prompt_tokens_per_second": 194.13659686497735,
        "time_to_first_token_seconds": null
      },
      "response_bound": 64,
      "sampled_logprobs_sha256": "ac873b82dc6266f08d49daa8851ae5ff969a9502fc09d0c46f0f11ef3fc7a983",
      "samples_per_prompt": 4,
      "sampling": "greedy",
      "status": "completed"
    },
    {
      "cell_id": "p128-r64-n4-seeded_stochastic",
      "counts": {
        "generated_tokens": 1024,
        "generated_trajectories": 16,
        "logical_prompts": 4,
        "physical_batches": 4,
        "prompt_tokens": 2048
      },
      "error": null,
      "memory": {
        "peak_allocated_bytes": 576205312,
        "peak_reserved_bytes": 1130364928,
        "process_rss_bytes": 2620805120,
        "teardown_residual_allocated_bytes": 8520704
      },
      "oom_downshifts": 0,
      "output_token_ids_sha256": "3b4b83de35b1d649fe3f49cf2489de7a434a97304abb50ee7ef985da4ea3b328",
      "phases": {
        "actor_update": {
          "note": "rollout-only baseline cell; full-cycle measurement is a separate gate",
          "status": "not_measured"
        },
        "cold_start": {
          "median_seconds": 8.762755541000004,
          "minimum_seconds": 8.762755541000004,
          "note": "shared actor/tokenizer load measurement repeated on each cell",
          "status": "measured"
        },
        "decode": {
          "note": "the pre-v0.11 public backend does not expose a decode boundary",
          "status": "not_measured"
        },
        "full_cycle": {
          "note": "rollout-only baseline cell; no phase is represented as zero",
          "status": "not_measured"
        },
        "policy_sync": {
          "note": "hf_reference uses the actor already loaded in the trainer process",
          "status": "not_applicable"
        },
        "prefill": {
          "note": "the pre-v0.11 public backend does not expose a prefill boundary",
          "status": "not_measured"
        },
        "rollout_total": {
          "median_seconds": 34.194360034,
          "minimum_seconds": 33.98181499500001,
          "status": "measured"
        },
        "teacher_scoring": {
          "note": "rollout-only baseline cell; full-cycle measurement is a separate gate",